{"$defs":{"span_ref":{"additionalProperties":false,"properties":{"block_id":{"enum":["B_GLOBAL_PREMISE","B_GLOBAL_TYPED","B_GLOBAL_DESCENT","B_GLOBAL_CAR","B_GLOBAL_ORDER","B_GLOBAL_ALL"]},"relative_path":{"const":"review_packets/STAGE7_QSPEC_CANDIDATE_V001/BID_GLOBAL_BOUNDARY_DESCENT_QUASI_FREE_COMPLETENESS_V001.md"},"source_sha256":{"const":"949181d78aca143ebef06eacc4ab1018d43cdf79962ee8c78c350f654a7555dd"},"span":{"items":false,"maxItems":2,"minItems":2,"prefixItems":[{"minimum":0,"type":"integer"},{"minimum":0,"type":"integer"}],"type":"array"},"span_sha256":{"pattern":"^[0-9a-f]{64}$","type":"string"}},"required":["block_id","relative_path","source_sha256","span","span_sha256"],"type":"object"}},"$id":"urn:rd22:step11:sp2-05:typed-global-graph:v001","$schema":"https://json-schema.org/draft/2020-12/schema","additionalProperties":false,"properties":{"car_algebras":{"const":["CAR(K_Sigma)"]},"global_source_space":{"const":"K_Sigma=K_orb tensor S_Dirac"},"record_factor_family":{"const":{"carrier":"R_c=span_C{|r_c>,|p_c>,|e_c>}","distinct_by_cell":true,"fermion_grading":"EVEN"}},"row_id":{"const":"C-B-V011-SP2-05"},"schema":{"const":"rd22.step11.sp2-05.typed-global-graph.v001"},"source_bindings":{"items":{"$ref":"#/$defs/span_ref"},"minItems":2,"type":"array"},"typed_maps":{"items":{"type":"object"},"minItems":5,"type":"array"},"typed_objects":{"items":{"type":"object"},"minItems":6,"type":"array"}},"required":["schema","row_id","source_bindings","global_source_space","car_algebras","record_factor_family","typed_objects","typed_maps"],"type":"object"}