{"car_algebras":["CAR(K_Sigma)"],"global_source_space":"K_Sigma=K_orb tensor S_Dirac","record_factor_family":{"carrier":"R_c=span_C{|r_c>,|p_c>,|e_c>}","distinct_by_cell":true,"fermion_grading":"EVEN"},"row_id":"C-B-V011-SP2-05","schema":"rd22.step11.sp2-05.typed-global-graph.v001","source_bindings":[{"block_id":"B_GLOBAL_TYPED","relative_path":"review_packets/STAGE7_QSPEC_CANDIDATE_V001/BID_GLOBAL_BOUNDARY_DESCENT_QUASI_FREE_COMPLETENESS_V001.md","source_sha256":"949181d78aca143ebef06eacc4ab1018d43cdf79962ee8c78c350f654a7555dd","span":[1103,1704],"span_sha256":"daeb7bc7b448e78009703e6fc7a7946a76844f7ee6f479327e63ab6ab84057d2"},{"block_id":"B_GLOBAL_DESCENT","relative_path":"review_packets/STAGE7_QSPEC_CANDIDATE_V001/BID_GLOBAL_BOUNDARY_DESCENT_QUASI_FREE_COMPLETENESS_V001.md","source_sha256":"949181d78aca143ebef06eacc4ab1018d43cdf79962ee8c78c350f654a7555dd","span":[1705,4005],"span_sha256":"fcbb16c6cad76b08a210d55d42a1ce82d165ae3a0adfd63f28ba16f30946d1ce"},{"block_id":"B_GLOBAL_CAR","relative_path":"review_packets/STAGE7_QSPEC_CANDIDATE_V001/BID_GLOBAL_BOUNDARY_DESCENT_QUASI_FREE_COMPLETENESS_V001.md","source_sha256":"949181d78aca143ebef06eacc4ab1018d43cdf79962ee8c78c350f654a7555dd","span":[4006,5026],"span_sha256":"f08456525bf3f5abb163b32bc3e7c9d1f084c79adb1d1ede879df10cc6cad76b"}],"typed_maps":[{"domain":"cell incidence maps","map":"PUSHOUT","range":"global labeled vertex quotient"},{"domain":"d_c","map":"NORMALIZED_RANK_ONE_PROJECTOR","range":"End(K_orb)"},{"domain":"c_c","map":"iota_c","range":"B(R(K))"},{"domain":"h_K","map":"NUMBER_PRESERVING_CAR_LIFT","range":"CAR(K_Sigma) tensor B(R(K))"},{"domain":"vertex labels","map":"FINITE_PERMUTATION","range":"U(K_orb)"}],"typed_objects":[{"name":"K_Sigma","type":"ONE_GLOBAL_SOURCE_ONE_PARTICLE_SPACE"},{"name":"CAR(K_Sigma)","type":"ONE_GLOBAL_CAR_ALGEBRA"},{"name":"R_c","type":"DISTINCT_EVEN_RECORD_FACTOR"},{"name":"P_c","type":"ORIENTATION_INVARIANT_SOURCE_PROJECTOR"},{"name":"h_K","type":"OPERATOR_VALUED_ONE_PARTICLE_SUPERCONNECTION"},{"name":"H_K","type":"NUMBER_PRESERVING_QUASI_FREE_CAR_LIFT"}]}